{
  "schema_version": "ccc-native-canary-result-v2",
  "scenario_id": "fast-route-fallback",
  "fixture_sha256": "57a300ca2c47d94eef7164172908bae1448c4d0a9cabef15a2f486b68861bc76",
  "execution_route": null,
  "capability_lane": "fast",
  "assurance_route": "parent-check",
  "expected_child_count": 1,
  "observed_child_count": 1,
  "children_distinct": null,
  "worktree_unchanged": true,
  "lane_observations": [
    {
      "lane": "classification",
      "requested_model": "gpt-5.3-codex-spark",
      "resolved_model": "gpt-5.6-luna",
      "requested_effort": "low",
      "resolved_effort": "low",
      "fallback": "spark_to_luna",
      "fallback_cause": "quota_denied",
      "failure_class": "none",
      "verification": "VERIFIED"
    }
  ],
  "task_result": "PASS",
  "wall_time_ms": 40013,
  "parent_rework": "none"
}
