{
  "schema_version": "ccc-native-canary-result-v2",
  "scenario_id": "frontier-seeded-defect-review",
  "fixture_sha256": "bea09417f9e2f567577117498b3460dd22a86fee61bc69978c9f48b608382dea",
  "execution_route": null,
  "capability_lane": "frontier",
  "assurance_route": "independent-review",
  "expected_child_count": 1,
  "observed_child_count": 1,
  "children_distinct": null,
  "worktree_unchanged": true,
  "lane_observations": [
    {
      "lane": "review",
      "requested_model": "gpt-5.6-sol",
      "resolved_model": "gpt-5.6-sol",
      "requested_effort": "high",
      "resolved_effort": "high",
      "fallback": "none",
      "fallback_cause": "none",
      "failure_class": "none",
      "verification": "VERIFIED"
    }
  ],
  "task_result": "PASS",
  "wall_time_ms": 29636,
  "parent_rework": "none"
}
