{
  "schema_version": "ccc-native-canary-result-v2",
  "scenario_id": "standard-judgment",
  "fixture_sha256": "073532799183e25ba3c13a04a1eaf50727e90ec45e2e355971ecb9afa3786138",
  "execution_route": null,
  "capability_lane": "standard",
  "assurance_route": "parent-check",
  "expected_child_count": 1,
  "observed_child_count": 1,
  "children_distinct": null,
  "worktree_unchanged": true,
  "lane_observations": [
    {
      "lane": "judgment",
      "requested_model": "gpt-5.6-terra",
      "resolved_model": "gpt-5.6-terra",
      "requested_effort": "high",
      "resolved_effort": "high",
      "fallback": "none",
      "fallback_cause": "none",
      "failure_class": "none",
      "verification": "VERIFIED"
    }
  ],
  "task_result": "PASS",
  "wall_time_ms": 32660,
  "parent_rework": "none"
}
